<?xml version='1.0' encoding='UTF-8'?>
<Thing xmlns:xsi="http://www.w3.org/2001/XMLSchema-instance" xsi:noNamespaceSchemaLocation="C:\Users\Brandon\Desktop\Research\XML\Thing_XML.xsd">
	<Object>
		<FunctionalProperties>
			<objectName>Computer HWT1242-LAB</objectName>
			<brand>HP</brand>
			<model>Pavilion</model>
			<objectDescription>Computer Usage Availability</objectDescription>
		</FunctionalProperties>
		<Non-FunctionalProperties>
			<contextOfObject>
				<tag>Yes</tag>
				<description>Computer Available</description>
			</contextOfObject>
			<propertiesOfObject>
				<tag>School</tag>
				<description>Penn State Behrend</description>
				<tag>Building</tag>
				<description>Burke</description>
				<tag>Floor</tag>
				<description>Second Floor</description>
				<tag>Room</tag>
				<description>153</description>
				<tag>Printer</tag>
				<description>True</description>
				<tag>Dual Monitor</tag>
				<description>True</description>
			</propertiesOfObject>
		</Non-FunctionalProperties>
	</Object>
	<Service>
	<!--NOTHING HERE BECAUSE THERE IS NO REMOTE SERVICE-->
	</Service>
	<searchTags>
	<tag>Projector</tag>
	<tag>Study</tag>
	<tag>Class</tag>
	<tag>Classroom</tag>
	<tag>Available</tag>
	<tag>Availability</tag>
	<tag>Open</tag>
	<tag>Room</tag>
	
	</searchTags>
</Thing>
